<?xml version="1.0" encoding="UTF-8"?>
<?xml-stylesheet type="text/xsl" href="508.xsl"?>
<inventario xmlns:xsi="http://www.w3.org/2001/XMLSchema-instance"
 xsi:noNamespaceSchemaLocation="508.xsd">
    <producto codigo="P1">
        <peso unidad="kg">10</peso>
        <nombre>Ordenador</nombre>
        <lugar edificio="B">
            <aula>10</aula>
        </lugar>
    </producto>
    <producto codigo="P2">
        <peso unidad="g">500</peso>
        <nombre>Switch</nombre>
        <lugar edificio="A">
            <aula>6</aula>
        </lugar>
    </producto>
</inventario>